tweet_text,emotion_in_tweet_is_directed_at,is_there_an_emotion_directed_at_a_brand_or_product
mention check bunch free atx mention unofficial sxsw events list iphoneandroid link,,No emotion toward brand or product
mention check googletv ipad apps connected tv experience link sxsw connectedtv,,No emotion toward brand or product
mention check photo feed apple store sxsw link thanks mention mention mention,,No emotion toward brand or product
apples schiller white iphone debut spring dont also try sell faster speed cable sxsw link,,No emotion toward brand or product
best tsotchke sxsw far\x89ûómy iphone almost power powermat gave free fully charged battery link,,No emotion toward brand or product
congrats chris rt mention sxsw interactive award music category quotwilderness downtownquot mention mention mentione,,No emotion toward brand or product
annas social media picks week 031111 link covering social media japan ipad 2 sxsw,,No emotion toward brand or product
google social media rt mention interrupt regularly scheduled sxsw geek programming big news link,,No emotion toward brand or product
google social network circles coming today sxsw link,,No emotion toward brand or product
official everyone sxsw uses iphone,,No emotion toward brand or product
official apple store popped sxsw link,,No emotion toward brand or product
google circles sxsw shice via mention link,,No emotion toward brand or product
google circles reveal joint session aclu tonight video doesnt make think link sxsw mention,,No emotion toward brand or product
google circles googles latest social venture google circles reportedly wont launched sxsw today link,,No emotion toward brand or product
quotnarcissism amp challenge fb pagesquot link coupled w quotgoogles spam problemquot link explain circles quota bitquot sxsw,,No emotion toward brand or product
really excited first panel tapworthy ipad design headaches awesome book sxsw gsdm,,No emotion toward brand or product
really excited see documentary something ventured sxsw today rise intel apple genentech cisco amp atari,,No emotion toward brand or product
fedex truck unloading outside apple popup store sxsw ipad2,,No emotion toward brand or product
fedex trucks keep arriving tv crews interview people line first ipad2 sxsw popup apple store link,,No emotion toward brand or product
sxsw rackspace startup program cloud 20 ipad app launched link seo sem cloudcomputing topnews,,No emotion toward brand or product
sxsw \x89ûò rackspace startup program cloud 20 ipad app launched link rackspace sxsw topnews,,No emotion toward brand or product
ackward sitting back ballroom f acc looking left right im nonmacbook ipad oh sxsw,,No emotion toward brand or product
theres class war forming sxsw ipad 2 owners vs first gen owners,,No emotion toward brand or product
time coffee muffins news reading lenewz sxsw trade show booth 1422 behind googles,,No emotion toward brand or product
mention come tomorrow get iphone case zazzlesxsw sxsw zazzle sxswi link,,No emotion toward brand or product
come visit milyoni booth 1223 right big google sign sxsw link,,No emotion toward brand or product
sxsw conf 1 every 200 people mac ipad including happened pc becoming obsolete,,No emotion toward brand or product
apple congress nice rt mention apple set open popup shop core sxsw action link sxsw apple,,No emotion toward brand or product
egyptian content flood quotgoogle put two servers web came back upquot sxsw sxswsa,,No emotion toward brand or product
ipad app content needs shallow engaging sxsw,,No emotion toward brand or product
couple evo vs iphone video sxsw link,,No emotion toward brand or product
couple ipad paintings exhibited sxsw austin details gallery show opens friday link,,No emotion toward brand or product
google recreated code pacman doodle original bugs included sxsw googledoodles,Google,No emotion toward brand or product
want micro usb charger samsung android kindle sxsw starting 311 pay 10 7 days link snapgoods,,No emotion toward brand or product
bjdproductions apple heads sxsw sets temporary store austin link tech,,No emotion toward brand or product
bjdproductions apple opening popup store austin sxsw link tech,,No emotion toward brand or product
bjdproductions apple opening popup store austin sxsw geekfest apple link tech,,No emotion toward brand or product
bjdproductions apple saves sxsw set open popup store link tech,,No emotion toward brand or product
bjdproductions lightboxphotos wants new android camera app sxsw link tech,,No emotion toward brand or product
bjdproductions sxsw apple schools marketing experts link tech,,No emotion toward brand or product
bjdproductions google launch new social network sxsw link tech,,No emotion toward brand or product
media circus guy walks apples popup store sxsw 1st ipad2 austin 6th amp congress link,,No emotion toward brand or product
sosososo cuteeeeee link thingsthatdontgotogether jalen rose sxsw ipad,,No emotion toward brand or product
googles cutts says reputation topicality 2 keys matter site rankings qagb sxsw,,No emotion toward brand or product
would copyright look like created today w mention ceopres floor64 inc amp william patry sr copyright counsel google sxsw,,No emotion toward brand or product
apple hp popping sxsw setting temp sites link austin atx austinbusiness,,No emotion toward brand or product
extra ipad 2 sale austin convention center wants one link,,No emotion toward brand or product
google aclu buddies\x89ûïmention google launch major new social network called circles possibly today link sxsw\x89û\x9d,,No emotion toward brand or product
would via mention apples opened popup store austin nerds mention sxsw get new ipads link cnet,,No emotion toward brand or product
google bing sitting panel dont look like want punch face cc mention sxsw,,No emotion toward brand or product
surrounded tats piercings live music gadgets galore yep hipster heaven google gsdm welivehere wepartyhere sxsw,,No emotion toward brand or product
quotipad cleanerquot takes two different terms sxsw,,No emotion toward brand or product
quotipad design headaches 2 tablets call morningquot sxsw packed,,No emotion toward brand or product
sxsw crowd earns 10k charity playing game pics unusual keynote speech link news sxsw cyber iphone,,No emotion toward brand or product
ladies gentlemen mr street rt mention ive meetings im line sxsw popup apple store ipad2,,No emotion toward brand or product
ipad 2 rivals stack link bnet biz ipad2 apple sxsw ipad tablet xoom tech laptop pics sale,,No emotion toward brand or product
free ipad lounge open daily sxsw serving art made ipads local art free coffee mention austin details link photo,,No emotion toward brand or product
best brand marketing sxsw ge mention solar powered carousel mention rock n roll trailer park apples ipad2 popup shop,,No emotion toward brand or product
aha found proof lactation room excuse quotmothers roomquot brought google last years sxsw link,,No emotion toward brand or product
sxsw ipad store sold everything except 64gig wifi white,,No emotion toward brand or product
hah found quotpopupquot apple store ipad 2 sale 2moro golds gym 6th congress link sxsw,,No emotion toward brand or product
saved sxsw im productive dont get anything done ipad dongle get getm sxswbusy,,No emotion toward brand or product
found back door sxsw apple store ip2 ftw,,No emotion toward brand or product
almost worst sxsw fail left iphone kitchen counter realized 5 min driving airport,,No emotion toward brand or product
dont need charge sxsw youre talking sun iphone link boom,iPhone,No emotion toward brand or product
read tv recaps online keep shows 600 unread posts google reader im completely detached sxsw,,No emotion toward brand or product
interested see google show unveil circles sxsw,,No emotion toward brand or product
android version rt mention mention download mention iphone reserve space sxsw,,No emotion toward brand or product
html 5 google booth sxsw link,,No emotion toward brand or product
dont hold breath google circles least sxsw link,,No emotion toward brand or product
stay tuned mention next emergency ipad station sxsw facebook bullying online privacy link,,No emotion toward brand or product
poked liked retweeted google love story alisa icrossing sxsw futurefifteen,,No emotion toward brand or product
shouldshouldnt get ipad 2 discuss sxsw,,No emotion toward brand or product
mention dan die maar doen p rt mention sxsw ipad store sold everything except 64gig wifi white,,No emotion toward brand or product
dangerous ipad life link jaqueline bojan sxsw,,No emotion toward brand or product
ipad 2 update online sales start 1201am pst 3am est 31111 2day free shipping fyi sxsw popup store downtown austin apple,,No emotion toward brand or product
mobile updates rt mention hoot new blog post hootsuite mobile sxsw updates iphone blackberry amp android link,,No emotion toward brand or product
justmet david beyond stories guys making drunken ipad purchases apple pop store sxsw whattechnerdsdodrunk,,No emotion toward brand or product
musicmonday great time sxsw played white stripes amp 60secondcrush mention detroit showcase lucys link,,No emotion toward brand or product
happy pi day google doesnt launch circles pi day doesnt exist sxsw,,No emotion toward brand or product
dumb blonde link evelyn sxsw juwan howard ipad,,No emotion toward brand or product
woah dude sxsw gets branded tattoo exchange ipad really link mention,,No emotion toward brand or product
dude propping ipad urinal time isnt valuable sxsw ewww,,No emotion toward brand or product
big idea google leaves nothing left discover link sxsw sxswi,,No emotion toward brand or product
bands needed sx podcast link sxsw,,No emotion toward brand or product
giving added value location based services needs battle checkin fatigue google pnid sxsw,,No emotion toward brand or product
mention definitely yobongo real time chat sxsw going killer link,,No emotion toward brand or product
watching demo google hotpot people using sxsw,,No emotion toward brand or product
wondering many mention come back sxsw ipad 2s maybe everyone,,No emotion toward brand or product
dudes dudes check tweet anything w ipad amp naked lady response bots tell simply gaimed one free sxsw,,No emotion toward brand or product
sxsw tradeshow floor engage w multitouch interactive wall take part augmented reality 3d enter win ipad,,No emotion toward brand or product
ipad design panel hilton salon j filling quickly surprises tapworthy sxsw,,No emotion toward brand or product
possible dì©voilement au sxsw rt mention google launch major new social network called circles possibly today link,,No emotion toward brand or product
sxsw predicts grouptexting nextbig thing fast society comes android amp updates iphone app link via mention,,No emotion toward brand or product
mention austin mention sxsw link,,No emotion toward brand or product
mention find hours apple store im curious sxsw,,No emotion toward brand or product
mention hear rumor might special apple popup store sxsw specifically ipad2 launch,,No emotion toward brand or product
mention see tweet reipad 2 sold sxsw,,No emotion toward brand or product
mention see apple opening temporary store sxsw ipad 2 launch maybe transfer,,No emotion toward brand or product
mention snag ipad 2 yesterday thoughts far sxsw,,No emotion toward brand or product
n5 spreading disease link codes valid 40075959p 031111 infektd sxsw necro,,No emotion toward brand or product
intending bring trusty backpack upcoming trip sxsw number ipad 2s im helping buy back es posible,,No emotion toward brand or product
whos heading popup apple store today anyone know time sale starts sxsw sxswk,,No emotion toward brand or product
mention direct shot mention offering rewards checkins latitude starting austin sxsw link,,No emotion toward brand or product
mention discussing salsa ingredients mention mention industry party sxsw welivehere gsdm,,No emotion toward brand or product
mention discussing salsa ingredients mention mention industry party sxsw welivehere gsdm link,,No emotion toward brand or product
quotcredit card companies know 98 accuracy 2 yrs youre going get divorcedquot mention sxsw link,,No emotion toward brand or product
ipad djs need one 3am tuesday douche bags need apply sxsw,,No emotion toward brand or product
almost didnt bring ipad sxsw bc 1st gen lunch wondering sxsw hipster uniform year fb,,No emotion toward brand or product
mention get bonus points collect colors glow dark google cups googlekillsit sxsw,,No emotion toward brand or product
quotwe want undivided attention please take mobile phones ipad 2squot mention sxsw leanstartup,,No emotion toward brand or product
improve website rankings advice google bing sxsw link,,No emotion toward brand or product
mention iphone price point 4999 make even explosion carriers work plans sxsw bolinsxsw,,No emotion toward brand or product
mention doh share pic update ipad since im sxsw youll mail shirt,,No emotion toward brand or product
mention better boys bed amp downloading realty tv ipad trip sxsw thurs thanks,,No emotion toward brand or product
z7 lead dont follow link codes valid 40075959p 031111 infektd sxsw zlf,,No emotion toward brand or product
mention dont miss qampa googles mention amp bings mention ranking sxsw sessi mon 1230pmpart 1 smx,,No emotion toward brand or product
got android party sxsw androidsxsw heres painting time blahzay link,,No emotion toward brand or product
countdown sxsw begun mention there\x89û pick quotfried speakersquot itunes link,,No emotion toward brand or product
mention download mention iphone reserve space meet mingle escape sxsw go tosxswmyturnstonecom,,No emotion toward brand or product
native android ios dev newest version mention flash sxswadobemobile sxsw,,No emotion toward brand or product
friends sxswi new blog post hootsuite mobile sxsw updates iphone blackberry amp android link,,No emotion toward brand or product
picplz adds photo collections borders link android apple iphone itunes sxsw,,No emotion toward brand or product
apple heads sxsw sets temporary store austin link,,No emotion toward brand or product
apple heads sxsw sets temporary store austin link news sxsw,,No emotion toward brand or product
apple heads sxsw sets temporary store austin link apple ipad2 rancewilemon sxsw whetherapple,,No emotion toward brand or product
one lone dude awaits ipad 2 apple\x89ûªs sxsw store apple likely expected bigger crowd forming south link,,No emotion toward brand or product
one lone dude awaits ipad 2 apple\x89ûªs sxsw store apple likely expected bigger crowd\x89û link,,No emotion toward brand or product
one lone dude awaits ipad 2 apple\x89ûªs sxsw store link apple ipad2 sxsw tablets,,No emotion toward brand or product
mention dude theres earthquakes tsunamis ipad 2 sxsw get,,No emotion toward brand or product
sxsw hardware ipad rickshaw bag lunatik incase iphone4 battery pak flip nike bose buds sprint mifi \x89û link,,No emotion toward brand or product
ready mention magic happens mention us use zazzlesxsw hashtag create iphone case sxsw,,No emotion toward brand or product
anybody tell apple store sxsw white 16gb ipad verizon stock saturday,,No emotion toward brand or product
google body mention shares patients amp physicians wow sharing data amp interactive anatomy sxswh hcinno sxsw sxswi,,No emotion toward brand or product
taking ipad 2 plunge sxsw popup store congress keepingupwithdkm,,No emotion toward brand or product
sxsw waze link duking google personalized mapping experience friendly quotpanel crashingquot,,No emotion toward brand or product
really quotgoogle mequot going called quotcirclequot hmm see later today sxsw,,No emotion toward brand or product
whats buzz billings entrepreneurs win tech award sxsw mention link via mention technology,,No emotion toward brand or product
new google circles would nuanced sharing butgoogle says launch imminent link later today sxsw,,No emotion toward brand or product
service sxsw attendees apple opens popup ipad store austin scarbrough building congress avenue,,No emotion toward brand or product
rt mention setting temp store sxsw 2 sell ipad2 crazybrilliantconvenient link sxswi,,No emotion toward brand or product
one minute ago guy spoke outside apples popup austin store would got hands ipad 2 waited since 630am sxsw,,No emotion toward brand or product
hbd donated dime rt mention everyone coming sxsw friendly reminder ipad 2 friday amp birthday saturday,,No emotion toward brand or product
test drive xperia play mention mention details link least android sxsw,,No emotion toward brand or product
sxsw free app festival explorer helps find bands want see based music tastes link,,No emotion toward brand or product
new iphone app mention called dailygrape replacing winelibrary tv mobile content amp videos help make wine choices sxsw,,No emotion toward brand or product
ellen page appearance reduced mention iphone call hearts broken sxsw super,,No emotion toward brand or product
omg probably 100 people session already ipad 2 sxsw,,No emotion toward brand or product
im unique sxsw im one w iphone 3gs others followers iphone 4 winning,,No emotion toward brand or product
sxsw stop austin details gallery check ipad art link art,,No emotion toward brand or product
sxsw youll need qr code app iphone read vcards get qrafter gt link qrcode,,No emotion toward brand or product
attending sxsw please bring old mobile phones hope phones project link mention,,No emotion toward brand or product
slides available mention site mention touchingstories preso link sxsw,,No emotion toward brand or product
im barton creek apple storethe popup store open friday wa new shipment ipad 2 sxsw,,No emotion toward brand or product
ah iphone battery fully recharged courtesy mention charge anywhere find mention sxsw amp charge fly,,No emotion toward brand or product
two days last 6 months mobile usage google maps higher desktop marissa mayer sxsw,,No emotion toward brand or product
whats best ipad app offline viewing sxsw program,,No emotion toward brand or product
whats best site registeringviewing unofficial sxsw events want publicize nonsxswi archives event link,,No emotion toward brand or product
better living cloud computing sxsw session john wiley google bettercloud,,No emotion toward brand or product
better living cloud computing sxsw session john wiley google bettercloudlink link,,No emotion toward brand or product
smartphone breakdown sxsw unofficial 985 iphones 1 android 03 blackberry 02 symbian windows,,No emotion toward brand or product
foursquare ceo mention sounded openminded big partnership google ie acquisition sxsw wallstreet,,No emotion toward brand or product
sxsw 500 e cesar chavez st austin texas link sxsw,,No emotion toward brand or product
iphone developer meetup packed sxsw,,No emotion toward brand or product
google social may shortly find rt mention google launch major new social network called circles sxsw link,,No emotion toward brand or product
sxsw five faces buried iphone social apps standing baryet great time wouldnt believe hadnt lived,,No emotion toward brand or product
google get social texas link sxsw google,,No emotion toward brand or product
google get social texas link chrismessina facebook google googlecircles sxsw twitter,,No emotion toward brand or product
anyone going sxsw first time free lonely planet austin guide iphone tinyurlcom6gjmypj,,No emotion toward brand or product
going sxsw youll need qr code app iphone read vcards get qrafter gt link qrcode,,No emotion toward brand or product
one google doodle guys wacky powerglove thing want play sxsw link,,No emotion toward brand or product
looks like google publicly denying quotcirclesquot presented sxsw today,,No emotion toward brand or product
average google maps sees 40 users come mobile devices becoming connected mention sxsw donline dk,,No emotion toward brand or product
heading sxsw make sure mention holler gram link,,No emotion toward brand or product
new update hootsuite mobile sxsw updates iphone blackberry amp android link,,No emotion toward brand or product
inevitable huge lines ipads austin apple store sxsw link,,No emotion toward brand or product
looks like hour late getting ipad sxsw sadpanda,iPad,No emotion toward brand or product
someone austin let borrow iphone charger short time heart long time sxsw,,No emotion toward brand or product
sorry austin taking advantage \x89ûïmention mention paid 30 apple popup pepsi stand\x89û\x9d sxsw pedicabs,,No emotion toward brand or product
200 people line pop apple store sxsw,,No emotion toward brand or product
de ipad rt mention new ubersocial iphone app store includes uberguide sxsw link,,No emotion toward brand or product
win free ipad 2 webdoccom sxsw rt,,No emotion toward brand or product
google going try socialnetworking googlecircles announced today sxsw shall see,,No emotion toward brand or product
seems like every iphone app new update week guess sxsw factor,,No emotion toward brand or product
google buy foursquare quoti dont knowthats interesting questionquot said foursquare ceo crowley sxsw,,No emotion toward brand or product
google launching new social network today sxsw socialmedia link,,No emotion toward brand or product
btw livetweets coming marissa mayers presentation sxsw mayer vp consumer products mention jr,,No emotion toward brand or product
far longest line sxsw apple store,,No emotion toward brand or product
think ive messed mexican iphone trying update software sxsw app fittingly screen stuck 911 mode,,No emotion toward brand or product
get nav schemes done ipad shape lesson sxsw,,No emotion toward brand or product
league extraordinary h4ckers presented mention lightning talks technology sxsw mention speakeasy link,,No emotion toward brand or product
future google mapped sxsw kia recalls 70000 optimas top advertising news link,,No emotion toward brand or product
z33 ounce prevention link codes valid 120035959p 031411 infektd sxsw zlf,,No emotion toward brand or product
future reading online customization amp sharing tablets link sxsw,,No emotion toward brand or product
hehe apple opens temporary apple retail store austin ipad2 launch sxsw geeks link,,No emotion toward brand or product
every game app ad sxsw interactive guide shows either iphone ipad atampt amp sxsws two promos show wp7 amp android,,No emotion toward brand or product
buy online wait line rtmention apple sets temporary store sxsw link,,No emotion toward brand or product
14 people line ipd 2 sxsw mention apple store sxsw link,,No emotion toward brand or product
looks like pop apple store openingapple store employees emerging queue sxsw,,No emotion toward brand or product
anyone read heard anything google circles sxsw,,No emotion toward brand or product
get season clover touch link games stpatrick,,No emotion toward brand or product
sxsw come see bitbop austin gdgtaustin purevolume house 504 trinity monday march 14th link,,No emotion toward brand or product
anyone seen pop stores austin like cnn restaurant apple plus food trucks sxsw apple,,No emotion toward brand or product
apple stay downtown austin think yes mention apples popup sxsw store detail belies 2wk lifespan link,,No emotion toward brand or product
temp apple store 6th st austin sxsw closed night quottheyre stuff says austin cops barring door,,No emotion toward brand or product
temp apple store austin quite ipad2 left sxsw,,No emotion toward brand or product
temp apple store set downtown austin via \x89ûïmention even begins apple wins sxsw link dtphcom\x89û\x9d,,No emotion toward brand or product
lets make temptohire position rt mention apple open temporary store sxsw 6th congress link,,No emotion toward brand or product
used small upstarts twitter played sxsw big guys making moves apple google sxsw,,No emotion toward brand or product
c43 quite specimen link codes valid 800115959a 031511 infektd sxsw cvdc,,No emotion toward brand or product
front gate tickets present morning party 318 httpssitesgooglecomsitefrontgatesxsw11 sxsw music,,No emotion toward brand or product
sxsw come privacybootcamp startups mention mention google facebook acc 9abc starting sxswi,,No emotion toward brand or product
brains zombies like content google mention quoted mention contentrules sxsw,,No emotion toward brand or product
brains zombies like content google quotcontent rulesquot mention sxsw,,No emotion toward brand or product
every time u hold yur ipad 2 air snap pic reminds priest holding bible except designed california sxsw,,No emotion toward brand or product
iphone users really clueless android os ui presentation seem basic everyone else sxsw,,No emotion toward brand or product
hey iphone users instagram hipstamatic enjoy using sxsw week sure making things interesting,,No emotion toward brand or product
attn dude using new ipad camera middle overcrowded sxsw presentation rock fail,iPad,No emotion toward brand or product
iphone version flipboard totally redesigned platform mention says sxsw,,No emotion toward brand or product
loving video google geo geeks skiing lake tahoe marissagoogle sxsw,,No emotion toward brand or product
n14 blood link codes valid 40075959p 031211 infektd sxsw necro,,No emotion toward brand or product
looks like may able fork cash new ipad2 sxsw link,,No emotion toward brand or product
email interview mention japan iphone week nothing surprising sxsw,,No emotion toward brand or product
mr google mention recommend submitting article banks seo strategy link im big fan sxsw,,No emotion toward brand or product
strange mixed tweets ipad spammers sxsw regular life together wpacific rim rocking near nuclear disaster compute,,No emotion toward brand or product
iphone mute tags people conversations\x89û quotso mention mobile sxsw notatsxsw quot rt mention,,No emotion toward brand or product
pdparticle mention said wont able get ipad 2 sxsw apple opening popup store link,,No emotion toward brand or product
