tweet_text,emotion_in_tweet_is_directed_at,is_there_an_emotion_directed_at_a_brand_or_product
sony area buffalo billards tweeting google tv sxsw,,No emotion toward brand or product
pengen jdnya rt mention new ubersocial iphone app store includes uberguide sxsw sponsored cont link,,No emotion toward brand or product
google denying appearance circles crop fields sxsw existence next socialmedia,,No emotion toward brand or product
big ups mention awesome austin newbies map link sxsw,,No emotion toward brand or product
heading mention pvhouse first 2 snackers tweet us amp find one popchicks win iphone 4 case sxsw,,No emotion toward brand or product
heading sxsw austin tx staying mention \x89ûó longtime mac developer smartfriendtm developer ipad app chamention,,No emotion toward brand or product
heading sxsw weekend author hosting android dev meetup stop link,,No emotion toward brand or product
heading sxsw hosting android dev meetup 130230pm details follow lets plan geeking,Android,No emotion toward brand or product
talking 15 year old iphone developer genius came sxsw proud dad sxsw mention bd rileys irish pub link,iPhone,No emotion toward brand or product
go rt mention google launch major new social network called circles possibly today link sxsw,,No emotion toward brand or product
google announce google circles social network sxsw link seo sem googlecircles topnews,,No emotion toward brand or product
heading austin check evrs sxsw preview show link also available shows via evrmobile iphone amp android,,No emotion toward brand or product
awesome rt mention headed austin sxsw check map newbies link mention enjoy,,No emotion toward brand or product
heading ballroom see googles marissa mayer mention sxsw,,No emotion toward brand or product
excited part mention twitter family stop pepsico playground sxsw learn win ipad,,No emotion toward brand or product
warning dictators longer hide stinkin f1 racetrack backyard say hello google earth sxsw,,No emotion toward brand or product
link two friendly austin police guarding apple store ipad hand sxsw,,No emotion toward brand or product
one way go job search sxsw quotare guys hiringquot man audience googles mention qampa,,No emotion toward brand or product
guess google social network yet soon socialmedia sxsw facebook monopoly integration link,,No emotion toward brand or product
heading hear mention detouring pop apple store sxsw,,No emotion toward brand or product
google launch major new social network called circles possibly today link sxsw,,No emotion toward brand or product
google launch major new social network called circles possibly today link rt mention sxsw,,No emotion toward brand or product
google launch major new social network called circles possibly today sxsw link,,No emotion toward brand or product
google launch major new social network called circles possibly today link socailmedia facebook networks sxsw tech,,No emotion toward brand or product
google launch major new social network called circles possibly today mention link via mention sm sxsw,,No emotion toward brand or product
google launch major new social network called circles possibly today link sxsw,,No emotion toward brand or product
google launch social network may independentie link sxsw,,No emotion toward brand or product
heading lunch mention bd ridleys link refresh austin welcome lunch sxsw event,,No emotion toward brand or product
awesome meet mention mention mention standing apple queue sxsw yesterday day 2,,No emotion toward brand or product
came school last thursday febuary link ipad sxsw,,No emotion toward brand or product
heading talk mention searchengineland sxsw qampa session mention amp bing,,No emotion toward brand or product
heading apple popup store sxsw,,No emotion toward brand or product
made front line apple store sxsw ipad2,,No emotion toward brand or product
strange think last year ipad ie9 preview released sxsw,,No emotion toward brand or product
welcome tx make friends spend lotsa money amp importantly look ur iphone occasionally u expect 2 get run sxsw,,No emotion toward brand or product
well hello sxsw heres free mention sampler celebrate festival year including barton hollow link,,No emotion toward brand or product
really google circles rt mention launching products sxsw plenty else,,No emotion toward brand or product
talking local search surprises google hotpot weight reviews heavier sites results cc mention sxsw,,No emotion toward brand or product
talking social media monitoring platforms sm2 vs radian6 vs google analytics smmnextgen sxsw right line w convo last night,,No emotion toward brand or product
35 socialmedia music stories may missed weekend link via mention sxsw ipad2 iphone,,No emotion toward brand or product
earlier today story guy named shawn blanc link mac apple sxsw cc mention,,No emotion toward brand or product
google doodles aim bring people together socially promote communal experience sxsw googledoodles,,No emotion toward brand or product
anybody know apple popup store sxsw,,No emotion toward brand or product
google doesnt view final end rather tool pointing users sources make decisions marissagoogle sxsw,,No emotion toward brand or product
front mention popup store sxsw last night link,,No emotion toward brand or product
light sxsw amp ipad2 launch tech forget quake victims japan good tech google peoplefinder link,,No emotion toward brand or product
speaking sxsw almost done wthis massive schedule anyone going next wk check link,,No emotion toward brand or product
cult apple emotional responses experiences magical works art control ecosystem sxsw technopriest,,No emotion toward brand or product
1 lots fun rt mention mention hollergram app killing sxsw link,,No emotion toward brand or product
millions iphone cases sxsw trade show double shuffleboard wax sprinklers think fail cc mention,,No emotion toward brand or product
speaking mapping mention sxsw mindjet give away ipad 2 best show entering ez see details link,,No emotion toward brand or product
download day lonely planet austin free limited time link iphone,,No emotion toward brand or product
z1 dawn dead link codes valid 120035959p 031111 infektd sxsw zlf,,No emotion toward brand or product
n31 frying pan link codes valid 800115959a 031411 infektd sxsw necro,,No emotion toward brand or product
z40 eye storm link codes valid 800115959p 031411 infektd sxsw zlf,,No emotion toward brand or product
app themostistcom made mobile ios android also work safari google chrome sxsw,,No emotion toward brand or product
used 2 rt mention agnerd confession using laptop ipad amp blackberry follow sxsw afar see agchat rock,,No emotion toward brand or product
many austin follow mention find googlers sxsw link,,No emotion toward brand or product
many dont use apple cause one uses windows voluntarily kawasaki thisisdare sxsw,,No emotion toward brand or product
bandcamp offering one day free streaming music link music bandcamp music sxsw sxsw2011 cyber iphone,,No emotion toward brand or product
microsoft lounge 4th floor first 5 iphone android developers stop 245 get free entry windows phone mp 99 sxsw,,No emotion toward brand or product
google rooftop hacking party lego mindstorms sxsw mention speakeasy rooftop link photo,,No emotion toward brand or product
google aclu 1980s party college friend havent seen 18 years sxsw magic mention,,No emotion toward brand or product
unlike google analytics meant show others sharing capabilities sxsw bavcid,,No emotion toward brand or product
google dev event surrounded people much smarter rock sxsw,,No emotion toward brand or product
google doodles session sxsw ballroom b come say hello,,No emotion toward brand or product
google era mention google looks future mobile locationbased devices link sxsw,,No emotion toward brand or product
seeing google impact dashboard panel sxsw want tech details view source,,No emotion toward brand or product
great google presented mention marissagoogle sxsw,,No emotion toward brand or product
google keynote marissa meyer guy demoing new mobile products sxsw,,No emotion toward brand or product
rumour google launching circles social network rt mention launching products sxsw plenty else,,No emotion toward brand or product
40 google map search mobile sxsw mention acc ballroom w 78 others link,,No emotion toward brand or product
40 google maps usage mobile sxsw,,No emotion toward brand or product
40 google maps usage mobile 150m users using google maps mobile users drive 128 miles year google maps navigation sxsw,,No emotion toward brand or product
40 google maps usage mobile wow mention sxsw via mention,,No emotion toward brand or product
40 google maps use mobile sxsw,,No emotion toward brand or product
40 google maps use mobile sxsw,,No emotion toward brand or product
40 google maps use mobile says mention sxsw,,No emotion toward brand or product
40 google maps users mobile sxsw,,No emotion toward brand or product
q google hulu barry diller quoti dont know end good intentionsnow dotremendous conflictquot sxsw,,No emotion toward brand or product
google party gsdampm link sxsw,,No emotion toward brand or product
google party mention mention mention mention wwwgetdowncom msusxsw sxsw tweet youre jeremie,,No emotion toward brand or product
heres google realtime sxsw link via mention,,No emotion toward brand or product
20 google searches local information google trying fill need places hotpot services sxsw,,No emotion toward brand or product
google session waiting marissa mayer sxsw,,No emotion toward brand or product
mayer google hire 6000 people year response audience question quotare hiringquot sxsw jr,,No emotion toward brand or product
mass googlezation ranking indexing educational assets vs lost sea uncatalogued materials present futureofed gsdm sxsw,,No emotion toward brand or product
apple google intel go gaga go game mention mention link cc mention mention li sxsw,,No emotion toward brand or product
video google quotit gets betterquot one featured gets better book due 322 sxsw sxswhomo link,,No emotion toward brand or product
ben google think making fast aim product day one agileagency sxsw,,No emotion toward brand or product
digging john mcrees talk designing boomers maybe youll like research link sxsw yourmom olderadults,,No emotion toward brand or product
team android sxsw \x89ûò full party details revealed link news austin teamandroid,,No emotion toward brand or product
team android choice awards finalists announced link sxsw,,No emotion toward brand or product
oh quadroid new wintel qualcomm android sxsw cloud,,No emotion toward brand or product
team android party 313 710 u show us mention app mobile u enter win free nexus link sxsw,,No emotion toward brand or product
apples sxsw pop store ipad2 sayeth mention link,,No emotion toward brand or product
going sxsw austin want win ipad mindjet giving one away details link,,No emotion toward brand or product
going check apple popup shop sxsw sxswi let us know link ipad2,,No emotion toward brand or product
going wordpress sxsw bbq instead standing line ipad wondering applecom deliver nonbilling addr,,No emotion toward brand or product
austin hookers please accept apple products coochie sxsw,,No emotion toward brand or product
google spokewoman nadja blagojevic email google circle quotwe announcing anything like sxsw untrue rumorquot,,No emotion toward brand or product
google looking launch new social link sxsw,,No emotion toward brand or product
google looks future mobile locationbased devices link sxsw,,No emotion toward brand or product
eww lol rt mention saw guy tweeting ipad peeing sxsw,,No emotion toward brand or product
put old gen 1 ipad sxsw,,No emotion toward brand or product
rt coolest iphone 4 amp ipad cases sxsw check fastcompanygrill zazzlesxsw sxswi http link,,No emotion toward brand or product
lack collaboration amp opportunism rt mention latin america produced next mention mention latism latam sxsw,,No emotion toward brand or product
technologist thinks quotsearch history see 125 person line get quotgoogle bing speak rankingquot sxsw,,No emotion toward brand or product
report mention google may announce circles new groupaware social network sxsw tonight link,,No emotion toward brand or product
rumors sxswcould true google launching secret new social network called quotcirclesquot link,,No emotion toward brand or product
ballroom couple sessions music ixd ipad design sxsw,,No emotion toward brand or product
urthotscom announces android promotion available first 25000 new users link sxsw sxswi,,No emotion toward brand or product
ballroom marissagoogle google vp consumer products interesting sxsw,,No emotion toward brand or product
mom ipad designing boomers sxsw link sxsw,,No emotion toward brand or product
latest moose tracker apple creates popup store downtown austin showcase new ipad 2 link sxsw,,No emotion toward brand or product
\x89÷¼ happy womans day make love fuss \x89÷ link \x89ã edchat musedchat sxsw sxswi classical newtwitter,,No emotion toward brand or product
c10 welcome machine link codes valid 120035959p 031211 infektd sxsw cvdc,,No emotion toward brand or product
someone going ask bing copying googles search results qagb sxsw seo,,No emotion toward brand or product
think someone making lot money week iphone international roaming charges sxsw,,No emotion toward brand or product
spotted something rare minutes agoa phone made apple besides mine sxsw,,No emotion toward brand or product
mention omg best conference time ever google sxsw 4sqchat,,No emotion toward brand or product
google competition task management solutions paper mention sxsw sxswdad,,No emotion toward brand or product
rt mention,,No emotion toward brand or product
rt mention apple popuitp store sxsw goes impulse control jmpi41h53 lt see good im ooc,,No emotion toward brand or product
rt mention google launch major new social network called circles possibly today link sxsw,,No emotion toward brand or product
rt mention google launch major new social network called circles possibly today link sxsw twnp socmedia,,No emotion toward brand or product
rt mention google tries launch new social network called circles link sxsw,,No emotion toward brand or product
rt mention google launch major new social network called circles possibly today link sxsw twnp socmedia,,No emotion toward brand or product
rt mention mention launch major new social network called circles possibly today link sxsw smm gtgtreally google,,No emotion toward brand or product
rt mention apple opening popup store austin sxsw link,,No emotion toward brand or product
rt mention marissa mayer google connect digital amp physical worlds mobile link sxsw,,No emotion toward brand or product
rt mention aron pilhofer new york times endorsed html ipad newsapps sxsw an\x89û cont link,,No emotion toward brand or product
rt mention aron pilhofer new york times endorsed html ipad newsapps sxsw asked us tweet actually said,,No emotion toward brand or product
rt mention aron pilhofer new york times endorsed html ipad newsapps sxsw asked us tweet,,No emotion toward brand or product
rt mention rt mention quotgoogle tweetquot new quotthink speakquot mark belinsky 911tweets panel sxsw,,No emotion toward brand or product
rt mention rt mention quantter launching iphone app soon participating launchrock comp sxsw link,,No emotion toward brand or product
rt mention mention double fisting keynote sxsw apple link,,No emotion toward brand or product
rt mention mention yes know using little quotjazz handsquot said pushio ipad winning sxsw sxswi,,No emotion toward brand or product
rt mention mention quotgoogle launched checkins month agoquot check ins ok check outs future sxsw bizzy,,No emotion toward brand or product
rt mention mention bahrain govt turned google earth result people learned govt turn back sxsw,,No emotion toward brand or product
rt mention mention imagines future google asks quotwhy want know thatquot search sxsw smscifi,,No emotion toward brand or product
rt mention mention competing mention circles socialflow board resonant topic sxsw link,,No emotion toward brand or product
rt mention mention needs help badass android developer right debugging emergency know anyone mention sxsw,,No emotion toward brand or product
rt mention mention mention manufacturing serendipity quothaving access information makes us curious lessquot sxsw,,No emotion toward brand or product
rt mention mention rec give bad apple job mtg taking notes make mtg voluntary gt willing participants gamestorming sxsw,,No emotion toward brand or product
rt mention mention reveals average time users spent nyts oscars ipad app 16mins quotthat blew mindquot newsapps sxsw,,No emotion toward brand or product
rt mention mention would like data dashboard govt knows like credit score google data dashboard sxsw,,No emotion toward brand or product
rt mention \x89ûïmention link lt help forward doc anonymous accounts techiesamp ppl help us jam libya sxsw,,No emotion toward brand or product
rt mention \x89ûïmention apple opening temporary store downtown austin sxsw ipad 2 launchquot oh yay traffic,,No emotion toward brand or product
rt mention \x89ûïmention get look sxsws rumored apple quotpopupquot store austin link,,No emotion toward brand or product
rt mention \x89ûïmention google launch major new social network called circles possibly today link sxsw,,No emotion toward brand or product
rt mention \x89ûïmention google launch major new social network called circles possibly today link sxsw\x89û\x9d circles closed weak,,No emotion toward brand or product
rt mention \x89ûïmention able afford attend sxsw buy ipad today consider saving japan earthquake relief quot,,No emotion toward brand or product
rt mention \x89ûïmention rumor apple opening temporary store downtown austin sxsw ipad 2 launch link,,No emotion toward brand or product
rt mention \x89ûïmention interrupt regularly scheduled sxsw geek programming big news link google circles\x89û\x9d sounds interesting,,No emotion toward brand or product
rt mention \x89ûïmore 35 million miles day driven google maps navigation assistedquot marissa mayer sxsw gps biz toast,,No emotion toward brand or product
rt mention \x89ûïthe classiest fascist company existence\x89û\x9d kara swisher sxsw apple,,No emotion toward brand or product
rt mention free music compilation sxsw featured artists link itunes amplifiedlife sxsw,,No emotion toward brand or product
rt mention fyi breaking google launch major new social network called circlestoday link via mention sxsw socialmedia,,No emotion toward brand or product
rt mention link mention new mobile app store circulars via android blackberry ios even austin amp sxsw link,,No emotion toward brand or product
rt mention link lt google circles looms googles nerds get social via mention sxsw socialmedia,,No emotion toward brand or product
rt mention link sxsw google going social,,No emotion toward brand or product
rt mention link wrote post possible sxsw blog ipad design piece went yesterday,,No emotion toward brand or product
rt mention link killer shot got last night mention nokiaconnects concert sxsw,,No emotion toward brand or product
rt mention link samsung galaxy ii appears fcc team android sxsw party link android followback,,No emotion toward brand or product
rt mention link insane even reason go sxsw sxsw appletogo,,No emotion toward brand or product
mention mention apple ipad2 popup store mention sxsw like red cross emergency tent hipsters lol lt3 publicradio,,No emotion toward brand or product
rt mention mention mention amp mention fun google pic sxsw link,,No emotion toward brand or product
rt mention mention google think making fast aim product day one agileagency sxsw,,No emotion toward brand or product
rt mention mention anyone knows mention found deaddd iphone outside blogger loungecontact reunite sxsw,,No emotion toward brand or product
rt mention mention mention apple set open popup shop core sxsw action link ipad2,,No emotion toward brand or product
rt mention mention mention apple open temporary store friday scarbrough building 6th congress sxsw link,,No emotion toward brand or product
rt mention mention mention austin street closures sxsw google map form link sxsw austin,,No emotion toward brand or product
rt mention mention mention check link sxsw google,,No emotion toward brand or product
rt mention mention mention google launch social networking site called circles soon officially sxsw link,,No emotion toward brand or product
rt mention mention mention great meet mention meetup post new sxsw medical apps link sxswh hcsm,,No emotion toward brand or product
rt mention mention mention taking google tour tomorrow bay area tom nightflying 2 aus 4 sxsw ltltlucky,,No emotion toward brand or product
rt mention mention mention bring great toys demos thanks including us look sxsw booth right next google,,No emotion toward brand or product
rt mention mention mention apple v android things going tomorrow mention sxsw,,No emotion toward brand or product
rt mention mention amp mention becoming competitors 4 mention theyre starting realize checkins cool sxsw,,No emotion toward brand or product
rt mention mention amp mention quick encourage seo practitioners avoid dwelling page rank focus content sxsw,,No emotion toward brand or product
rt mention mention 2 sxsw apple opening popup store austin sxsw link,,No emotion toward brand or product
rt mention mention mention open 64gb 3g ipad 2 unboxing first look mention ipad2 ipad apple link via webdoc sxsw,,No emotion toward brand or product
rt mention mention announces windowsphone app today sxsw link wp7,,No emotion toward brand or product
rt mention mention around sxsw need us sim iphone 3gs next 10 wan na bring one please,,No emotion toward brand or product
rt mention mention sxsw google connect digital amp physical worlds mobile link link,,No emotion toward brand or product
rt mention mention best thing ive heard sxsw quoti gave ipad 2 money japan relief dont need ipad 2mention mention sxswgood,,No emotion toward brand or product
rt mention mention dont miss qampa googles mention amp bings mention ranking sxsw sessi mon 1230pmpart 1 smx,,No emotion toward brand or product
rt mention mention dude theres earthquakes tsunamis ipad 2 sxsw get,,No emotion toward brand or product
rt mention mention enchantment get trustworthiness zappos likeability virgin product apple mention sxsw,,No emotion toward brand or product
rt mention mention google taking mic health2dev sxsw,,No emotion toward brand or product
rt mention mention google launch major new social network called circles possibly today link sxsw,,No emotion toward brand or product
rt mention mention google analytics 58967 visits ipad iphone ranked top 5 ways people access newsapps sxsw,,No emotion toward brand or product
rt mention mention yall seen temp apple store going downtown sxsw would yall stream instead link,,No emotion toward brand or product
rt mention mention help us get word sxsw party featuring mention ipad2 giveaway link,,No emotion toward brand or product
rt mention mention hey rudy belgiums dutch taking sxsw launched wwwskylinesnet link today,,No emotion toward brand or product
rt mention mention biytly email like google voice email loveit sxsw startupbus,,No emotion toward brand or product
rt mention mention geek charlie sheen goddesses mention mention schmittastic google sxsw,,No emotion toward brand or product
rt mention mention talking mobile phones google earth fb empowering people fight back dictators sxsw,,No emotion toward brand or product
rt mention mention new ipad apps speechtherapy communication showcased sxsw conference link iear edchat asd,,No emotion toward brand or product
rt mention mention new ipad apps speech therapy communication showcased mention sxsw conference link sxswi assistivetech,,No emotion toward brand or product
rt mention mention new ipad apps speech therapy communication showcased sxsw conference link sxswi hcsm sxswh,,No emotion toward brand or product
rt mention mention new ipad apps speech therapy communication showcased sxsw conference link augcomm hcsm mhealth,,No emotion toward brand or product
rt mention mention 1 hack found people jumping corporate firewall eg using google docs etc sxsw,,No emotion toward brand or product
rt mention mention rainey street nice alternative 6th street sxsw parties walking directions convention center link,,No emotion toward brand or product
rt mention mention recounts batshit insanity doubling quotcreativityquot ensures quotdont suckquot google michaels room groupon sxsw,,No emotion toward brand or product
rt mention mention shows apple position tablet wars tapworthy sxsw link,,No emotion toward brand or product
rt mention mention launch major new social network called circles link sxsw v mention mentionc,,No emotion toward brand or product
rt mention mention wan na sign beta link sxsw hhrs gtgt,,No emotion toward brand or product
rt mention mention actually giving away 10 free taplynx iphone ipad app licences away sxsw bitlypushsxsw11 check us,,No emotion toward brand or product
rt mention mention said wont able get ipad 2 sxsw apple opening popu\x89û cont link,,No emotion toward brand or product
rt mention mention said wont able get ipad 2 sxsw apple opening popup store austin sxsw link,,No emotion toward brand or product
rt mention mention worked mention create opensource s2 fill gap needed locationbased applications use nosql db model sxsw,,No emotion toward brand or product
rt mention mention yes thats favorited want win need win doo dah doo dah pushio sxsw ipad,,No emotion toward brand or product
rt mention mention grab latest mention sxsw link saytextson,,No emotion toward brand or product
rt mention lt10 minute line ipad 2 temporary apple store sxsw,,No emotion toward brand or product
