tweet_text,emotion_in_tweet_is_directed_at,is_there_an_emotion_directed_at_a_brand_or_product
teachntech00 new ipad apps speechtherapy communication showcased sxsw conference httphtly49n4m iear edchat asd,,No emotion toward brand or product
nan,,No emotion toward brand or product
holler gram ipad itunes app store httptcokfn3f5q via marcisken sxsw,,No emotion toward brand or product
attn sxsw frineds mention register gdgtlive see cobra iradar android link,,No emotion toward brand or product
anyone sxsw want sell old ipad,,No emotion toward brand or product
anyone sxsw bought new ipad want sell older ipad,,No emotion toward brand or product
sxsw oooh rt mention google launch major new social network called circles possibly today link,,No emotion toward brand or product
spin play new concept music discovery ipad mention amp spincom link itunes sxsw mention,,No emotion toward brand or product
vatornews google apple force print media evolve link sxsw,,No emotion toward brand or product
hootsuite hootsuite mobile sxsw updates iphone blackberry amp android whether you\x89ûªre getting friend link,,No emotion toward brand or product
hey sxsw long think takes us make iphone case answer mention using zazzlesxsw we\x89ûªll make one,,No emotion toward brand or product
mashable ipad 2 takes sxsw video ipad sxsw gadgets link,,No emotion toward brand or product
ipad rt mention new ubersocial iphone app store includes uberguide sxsw sponsored link,,No emotion toward brand or product
orly \x89ûïmention google set launch new social network circles today sxsw\x89û\x9d,,No emotion toward brand or product
khoi vinh mention says conde nasts headlong rush ipad publishing quotfundamental misunderstandingquot platform sxsw,,No emotion toward brand or product
\x89ûïmention link lt help forward doc anonymous accounts techiesamp ppl help us jam libya sxsw,,No emotion toward brand or product
\x89÷¼ \x89÷ link \x89ã edchat musedchat sxsw sxswi classical newtwitter,,No emotion toward brand or product
mention mention locationbased fast fun future link via mention sxsw,,No emotion toward brand or product
\x89ûïmention mention google connect digital amp physical worlds mobile link sxsw\x89û\x9d mention,,No emotion toward brand or product
link rt mention quotgoogle tweetquot new quotthink speakquot mark belinsky 911tweets panel sxsw,,No emotion toward brand or product
link rt mention sxsw check holler gram ipad app mention link,,No emotion toward brand or product
mention mention amp mention fun google pic sxsw link,,No emotion toward brand or product
quotvia mention link guy kawasaki talks enchanted sxsw knows stuff books internet apple sxsw quot,,No emotion toward brand or product
futuremf mention link spec recipes web google search link sxsw,,No emotion toward brand or product
smile rt mention think apples quotpopup storequot austin would lot interesting actually know popped sxsw,Apple,No emotion toward brand or product
agree rt mention wait fiona apple town somebody kidnap put recording studio records new album sxsw,,No emotion toward brand or product
sxsw mention mention wan na buy drink 7pm fado 4th link join us,,No emotion toward brand or product
check rt mention giving added value location based services needs battle checkin fatigue google pnid sxsw,,No emotion toward brand or product
chilcott mention sxsw stand talking blogger staff late win competition best tweet mentioning mention tshirt,,No emotion toward brand or product
gowallas mention promises launch foursquare checkin groupon rewardstype service sxsw fingers crossed link,,No emotion toward brand or product
haha rt mention sxsw news yahoocom loosing search traffic new site googlecom doubt last tho w weird name,,No emotion toward brand or product
worship mention link sxsw,,No emotion toward brand or product
ipad2 rt mention droid amp mac rt mention agnerd confession using laptop ipad amp blackberry follow sxsw,,No emotion toward brand or product
launching mention sxsw rt mention mention denies social network called circles debut today despite report link,,No emotion toward brand or product
nice rt mention apple opening popup store ipad launch downtown austin sxsw link via mention,,No emotion toward brand or product
stay tune mention showcase h4ckers link sxsw,,No emotion toward brand or product
thank mention mention touchingstories preso sxsw heres deck link,,No emotion toward brand or product
thank mention awesome sxsw party link,,No emotion toward brand or product
thanks rt mention youre trying contact friends family japan mention created person finder link sxsw,,No emotion toward brand or product
thanks mention publishing news new medical apps sxswi conf blog link sxsw sxswh mhealth,,No emotion toward brand or product
wonder mention amp mention apple flashmob tcrnchfcs45j sxsw ipad2,,No emotion toward brand or product
wonder mention putting tips mention api sxsw suxsw,,No emotion toward brand or product
yes rt mention hey mention ive got another gem gt free mention sxsw link sxsw,,No emotion toward brand or product
gsdampm amp googles industry party tonight mention see u link sxsw austin welivehere gsdm,,No emotion toward brand or product
new buzz quotmention google launch major new social network called circles possibly today link rt mention sxswquot,,No emotion toward brand or product
mention quotgoogle launched checkins month agoquot check ins ok check outs future sxsw bizzy via mention,,No emotion toward brand or product
attending quotleft brain search google right brain search xquot bettersearch talking future search engines sxsw,,No emotion toward brand or product
hp opens quotmobile parkquot amp content incubator sxsw link apple constructs quotpopupquot store link,,No emotion toward brand or product
kawasaki quotpagemaker saved applequot oh days sxsw jwtatl enchantment,,No emotion toward brand or product
unboxing apple sxsw mention apple store sxsw link,,No emotion toward brand or product
sxsw apple schools marketing experts sxsw cnet blogs link,,No emotion toward brand or product
sxsw apple schools marketing experts link,,No emotion toward brand or product
headed austin sxsw check map newbies link mention mention mention mention enjoy,,No emotion toward brand or product
funny austin trending sxsw matter minutes point least according twitter iphone,,No emotion toward brand or product
sxsw ux ipad uxdes remember ultimately aware audience app targeted towards unexpected experience good,,No emotion toward brand or product
googles mobile future elusive power link via mention eurorscg sxsw sxswi,,No emotion toward brand or product
notatsxsw sxsw heres link free download meet nearby peps,,No emotion toward brand or product
smallbiz need reviews play google placeswe got app thatlink seo sxsw,,No emotion toward brand or product
samsung sony follow apple hp lead mention link austin atx sxsw,,No emotion toward brand or product
samsung sony follow apple hp lead mention link austin atx sxsw via mention rg,,No emotion toward brand or product
q1 sxsw sxswi prep amazing pre push locally focus location based google owns 10 regions billboards pr20chat,,No emotion toward brand or product
sxsw accounts need follow apps download iphone,,No emotion toward brand or product
headed sxsw want sharegather contact info link turn iphone business card broadcaster,,No emotion toward brand or product
headed sxsw want sharegather contact info link turn iphone link,,No emotion toward brand or product
btw sxsw apple store sold 3g models vzw amp atampt,,No emotion toward brand or product
anyone sxsw popup apple store austin thats got ta hopping place today,,No emotion toward brand or product
fastball sxsw giving away two new ipad2 wifi 32g black apple cover tweet mention fo info sxswi attsxsw tonight mention bolt house,,No emotion toward brand or product
anyone sxsw chance check popup apple store wondering worth trek convention center,,No emotion toward brand or product
mention sxsw austin conference google search interactive music film,,No emotion toward brand or product
anyone sxsw know apple selling ipad 2,,No emotion toward brand or product
anyone sxsw know apple store new shipment ipads yet,,No emotion toward brand or product
marc ecko sxsw launches iphone app autodial political change link edreform edtech eduvc fightthepaddle,,No emotion toward brand or product
free sxsw mp3 downloads time itunes link,,No emotion toward brand or product
anyone sxsw heading aclu event seen owt google circles,,No emotion toward brand or product
mention sxsw prompt memory go google map describe childhood walk,,No emotion toward brand or product
essential sxsw tools link,,No emotion toward brand or product
following sxsw tweets google realtime four platforms tweet deck listening panel realizing im spoken one today,,No emotion toward brand or product
anyone sxsw want ipad 2 im line pick one someone willing pay 50 grab 1,,No emotion toward brand or product
solving sxswinduced iphoneintoilet crisis apple store mention crisis,,No emotion toward brand or product
attending sxsw austin guide mention free download itunes link lp,,No emotion toward brand or product
hey sxsw sxswi folks want learn security come bsidesaustin link,,No emotion toward brand or product
attending sxswi work iphone ipad game development looking hire austinbased ios developer im man lets talk sxsw,,No emotion toward brand or product
gsdampm google 710 rt mention whats best party hit tonight sxsw mention mention,,No emotion toward brand or product
gsdampm google industry party sxsw mention great meet link,,No emotion toward brand or product
sxsw day 1 marissa mayer google connect digital amp physical worlds mobile link,,No emotion toward brand or product
mention 1154 free songs sxsw year alone link,,No emotion toward brand or product
150 million mobile users google maps mobile sxsw,,No emotion toward brand or product
currently 150 people line quotpop apple storequot sxsw,,No emotion toward brand or product
ipad 2 available sxsw 64gb wifionly model 699 plus optional leather smart cover 69,,No emotion toward brand or product
\x89÷¼ love 2 entertain you\x89ûplease don\x89ûªt grateful \x89÷ link \x89ã edchat musedchat sxsw sxswi classical newtwitter,,No emotion toward brand or product
less 2 hours announce details ipad 2 giveaway sxsw sxswi,,No emotion toward brand or product
ipad 2 queue sxsw course,,No emotion toward brand or product
apple 200m users credit cards syncd itunes one click purchase winning sxsw,,No emotion toward brand or product
2nd cocktail quottexas snowflakequot mention google cnngrill sxsw,,No emotion toward brand or product
new post 3 iphone apps well using south southwest interactive sxsw sxswi link,,No emotion toward brand or product
rt 4 pm ipad2 line apple store longer wider \x89ûò 250 people one hour sxsw,,No emotion toward brand or product
u smart 4 packing extra rt mention way sunny austin sxsw extra iphone stow case mention mention,,No emotion toward brand or product
wonder 4sqwill attempt block gowalla crosscheckins way facebook blocked googles contacts connections sxsw lbswars,,No emotion toward brand or product
check 5 steps bulletproof ux strategy sxsw link sxsw rhjrux5 link,,No emotion toward brand or product
wandering 6th street girls stopped ceviche mojitos apple juice amp ice cream sxsw,,No emotion toward brand or product
weve got busy week ahead new book google apps available amazon amp attending sxsw,,No emotion toward brand or product
believe went aussies sxsw rt mention ipad 2 sold 70 went new buyers report link,,No emotion toward brand or product
\x89ûïmention google spreadsheet 270 parties sxsw year oo link mention plan going sxsw party,,No emotion toward brand or product
guy line apples popup store sixth street austin quotim guyquot told sxsw,,No emotion toward brand or product
ive seen lot tablets every single one ipad sxsw,,No emotion toward brand or product
receiving lot mention messages telling im sexy response post looking meet fellow christian iphone devs sxsw,,No emotion toward brand or product
thats news p rtmention google launch major new social network called circles possibly today link sxsw,,No emotion toward brand or product
took piss trade show ipad one hand iphone pissing kiiiiiilling right sxsw,,No emotion toward brand or product
hobo shotgun iphone game link sxsw,,No emotion toward brand or product
took survey iphone starbucks line got free starbucks gift card instant research instant gratification sxsw gsdm,,No emotion toward brand or product
apple temporary retail store austin ipad 2 release today opens 5pm sxsw sxswi ipad2,,No emotion toward brand or product
wondering circles gt google reveal new social network sxsw link,,No emotion toward brand or product
google search local marissa mayer sxsw,,No emotion toward brand or product
wondering street closures sxsw made google map show link sxsw austin,,No emotion toward brand or product
google another go social quotgoogle circlesquot sxsw google,,No emotion toward brand or product
questions whats inside ipad 2 fire way sxsw,,No emotion toward brand or product
paraormal activity sanctuary iphone game sketching ar experience interactivity quotmagic lensequot eduar sxsw,,No emotion toward brand or product
apple iie ad 85 si swimsuit issue garage sale sxsw link,,No emotion toward brand or product
flipboard adds instagram photos social search apps link apple socialsearch sxsw,,No emotion toward brand or product
spent aftrnoon frozen lake photographing brother scott amp mention team catch sxsw ths weeknd link,,No emotion toward brand or product
dj hoodie allen due respect probably make way back google sxsw,,No emotion toward brand or product
audioboo american dream bust link ipad sxsw bum begger us socialart documentally,,No emotion toward brand or product
skifta appbased media shifting service turns android phone sxsw mashable sxswi link,,No emotion toward brand or product
apple security guy locks store sxsw link,,No emotion toward brand or product
apple security guy locks store sxsw realtime sxsw link curated mention,,No emotion toward brand or product
got ipad 2 sxsw link cc mention,,No emotion toward brand or product
gsdampm googlesitting tree link sxsw gsdm,,No emotion toward brand or product
mention heres pic winning ipad unsix sxsw cc mention mention link cont link,,No emotion toward brand or product
iphone thirsty sxsw mention chevy volt lounge w 16 others link,,No emotion toward brand or product
iphone thirsty sxsw mention chevy volt lounge w 16 others link link,,No emotion toward brand or product
came left sxsw iphone playing song chosen random skreams listening records wall appropriate,,No emotion toward brand or product
arduino android flaming skulls link refrigerator speaks salon k 330pm mention mention sxsw smartthings,,No emotion toward brand or product
reminder android chrome tts talk mention 1 pm today link sxsw,,No emotion toward brand or product
ipad 2 vs android vs world panel sxsw today 330pm mention link,,No emotion toward brand or product
backupify announces cloudsight search first searchable archive solution social media google apps sxsw sxswi link,,No emotion toward brand or product
google announcing social network quotcirclesquot via sxsw tweets interesting myopia cause buzz jokes interesting,,No emotion toward brand or product
u see anything googles circles sxsw mention mention,,No emotion toward brand or product
sxsw app android huge props mention mention mention amp mention get link,,No emotion toward brand or product
iphone app screen sxsw missing link,,No emotion toward brand or product
sxsw apple quotpopupquot store nuts still packed 1130 link,Apple,No emotion toward brand or product
say apple sxsw popup store austin link mention mention,,No emotion toward brand or product
breaking apple announces partnership wporn industry new ipad2 video chat app called quotofacetimequot sxsw,,No emotion toward brand or product
surprise apple opened popup store austin nerds town sxsw get new ipads http link,,No emotion toward brand or product
technews apple heads sxsw sets temporary store austin link technews apple ipad2 rancewilemon sxsw tech,,No emotion toward brand or product
technews apple opening popup store austin sxsw link technews americanstatesman apple appleapple sxsw tech,,No emotion toward brand or product
technews apple opening popup store austin sxsw geekfest apple link technews apple brianlam ipad2 sxsw tech,,No emotion toward brand or product
sxsw apple schools marketing experts link,,No emotion toward brand or product
\x89ûïmention apple store downtown austin open til midnight sxsw\x89û\x9d ipad2 left stock,,No emotion toward brand or product
mention apple store congress link sxsw austin,,No emotion toward brand or product
2wks apple store 6th austin street opened sxsw,,No emotion toward brand or product
special apple store opening 6th congress sxsw amp ipad 2 launch wwwapplecomretailthedomain apple ipad2 sxsw fb,,No emotion toward brand or product
temporary apple store sxsw huge line link,,No emotion toward brand or product
temporary apple store sxsw line goes around block link,,No emotion toward brand or product
temporary apple store opens mention 6th amp congress tomorrow ipad2 sxsw,,No emotion toward brand or product
sxsw apple store opens noon day closes run ipad2s didnt buy stock 10 years ago,,No emotion toward brand or product
base camp apple sxsw link,,No emotion toward brand or product
lines already forming apples popup store austin arent people see festival link sxsw,,No emotion toward brand or product
sxsw attending sxsw report see android phone get bannka app,,No emotion toward brand or product
tweets stalled data sluggish come atampt verizon embarrassing iphone customers havent switched sxsw iphone,,No emotion toward brand or product
tweeting google coming circles platform today outside circle keep itsnot sxsw,,No emotion toward brand or product
\x89ûïmention stupid find sxsw mac link special price games mac\x89û\x9d,,No emotion toward brand or product
slate see much traffic mobile safari app ipad sxsw electricnews,,No emotion toward brand or product
unloading apple store corner 6th congress austin temp store sxsw link,,No emotion toward brand or product
great day sxsw jaloux mention amp new ipadlook school bus 1st day school link,,No emotion toward brand or product
arrived sxsw mention issue hasnt resolved dying use iphone app cant login rtmention mention,iPad or iPhone App,No emotion toward brand or product
sxsw screenburn mention launch clients new iphone game travellerarlaunch find link,,No emotion toward brand or product
anyone sxsw wants see demo piccraft ipad 2 find,,No emotion toward brand or product
sxsw could spend mention teaching theater alone look schedule link,,No emotion toward brand or product
youre sxsw meet us fado give wristbands magically lead beer come say hi link,,No emotion toward brand or product
youre sxsw want ipad 2 apples setting temporary store check link,,No emotion toward brand or product
youre sxsw meet author host android devs sat 1230pm hilton room 615ab,,No emotion toward brand or product
sxsw apple sets 5000squarefoot temporary store sxsw sell new ipads test potential traffic link,,No emotion toward brand or product
overheard sxsw quotgoogle doesnt launch products peoples eventsquot,,No emotion toward brand or product
nerd bait sxsw apple set open popup shop core sxsw action link,,No emotion toward brand or product
long line sxsw else apple store link,,No emotion toward brand or product
queue apple popup store sxsw link,,No emotion toward brand or product
posted dmi house intimate stranger stage got restaurant crowd sitting deal wif sxsw link,,No emotion toward brand or product
woman google talk sounded like chelsea handler lol sxsw,,No emotion toward brand or product
anyone attending google amp aclu party mention sxsw could plz pictures thanks sxsw,,No emotion toward brand or product
march 11 austin tx people line sxsw registration apple store,,No emotion toward brand or product
landed austin spotted google places ads sxsw airport quotthe ultimate austin pocket guidequot like yelp itouru,,No emotion toward brand or product
\x89ûïmention awesome meet mention mention mention standing apple queue sxsw yesterday day 2\x89û\x9dltlt cute,,No emotion toward brand or product
mention bahrain govt turned google earth result people learned govt turn back sxsw,,No emotion toward brand or product
racing ballroom see mention marissa mayer sxsw sxswi,,No emotion toward brand or product
another google wave rt mention interrupt regularly scheduled sxsw geek programming wbig google news link,,No emotion toward brand or product
yeah ill sure gtrt mention mention mention check link sxsw google,,No emotion toward brand or product
texas amazing ive met many influential people work twitter foursquare microsoft even apple sxsw winning,,No emotion toward brand or product
woke iphone finished recharging means got enough sleep last night right sxsw,,No emotion toward brand or product
quiet storm sxsw looking forward seeing googles marissa mayer,,No emotion toward brand or product
companies believing nfc google nexus nokia also carriers verifone even apple seems sxsw sxswnfc,,No emotion toward brand or product
cus pacman google singularity sxsw noobs meetup,,No emotion toward brand or product
far biggest sxsw mistake bringing iphoneipad charger,,No emotion toward brand or product
\x89ûïmention black white ipad sxsw ipad2\x89û\x9d question,,No emotion toward brand or product
hootsuite blog \x89ûò social media dashboard åè hootsuite mobile sxsw updates iphone blackberry amp android link,,No emotion toward brand or product
hootsuite blog \x89ûò social media dashboard åè hootsuite mobile sxsw updates iphone blackberry amp android link,,No emotion toward brand or product
hoot new blog post hootsuite mobile sxsw updates iphone blackberry amp android link,,No emotion toward brand or product
anyone bringing ipad vs computer sxsw,,No emotion toward brand or product
south southwest panels illustrated pics sometimes best link news ogilvy sxsw trending cyber iphone,,No emotion toward brand or product
google calendars saturday night giant overlap sxsw parties,,No emotion toward brand or product
anyone make cooler rt mention mention launch quotgroupon living socialtypequot rewards sxsw link,,No emotion toward brand or product
reminder charles chen talking android chromeos access today mention 1pm mention google booth exhibit hall 3 sxsw,,No emotion toward brand or product
tomorrow charles chen speaking android chromeos access mention google booth exhibit hall 3 mention 1pm sxsw,,No emotion toward brand or product
group chat apps sxsw told dl two apps yet avail android point ill need phone apps,,No emotion toward brand or product
remember chime tweets nasatweetup experience 215pm 3pm central time sxsw session link,,No emotion toward brand or product
daily chord tuesday march 8 hackers discover googles music servicestory rollin link sxsw music news,,No emotion toward brand or product
daily chord tuesday march 8 hackers discover googles music servicestory rolling stone mo link sxsw,,No emotion toward brand or product
google circle austin sxsw link,,No emotion toward brand or product
google circles sxsw link ht mention maybe theyre reconsidering shape,,No emotion toward brand or product
google circles buzz corners rounded might find today link sxsw google,,No emotion toward brand or product
google circles rt mention launching products sxsw plenty else,,No emotion toward brand or product
10 austin classics missed sxsw m4blogcom twitter iphone \x89û¢ 31211 1240 pm,,No emotion toward brand or product
tools collaboration across boundaries google webex dropbox whiteboarding basecamp joinme ipad sxsw evolvingworkplace,,No emotion toward brand or product
trying collaborate sxsw events friends google calendar plancast,,No emotion toward brand or product
sxsw come hear speak 40 mins designing ipad interfaces new navigation schemas ballrm 1100am uxdes mention,,No emotion toward brand or product
among coolgoofy things ive spied sxsw today ipad case made look like etchnsketch grown game tug war,,No emotion toward brand or product
wishes could mention mention mention party sxsw instead homework tomorrow,,No emotion toward brand or product
could find mention sxsw hes probably fiting ipad,,No emotion toward brand or product
check coyne pr updates sxsw link via mention,,No emotion toward brand or product
crazy look around sxsw realize last year one ipad sxsw,,No emotion toward brand or product
crazy big crowds sxsw mention apple store sxsw link,,No emotion toward brand or product
u read articlegoogle say rumor \x89ûïmention launch major new social network called circleslink sxsw\x89û\x9d,,No emotion toward brand or product
sxsw dl mention 4 iphone amp come uj booth acc hall 2 snap pics amp send em us fightthepaddle link,,No emotion toward brand or product
day 3 im tired hold ipad week death happy death sxsw,,No emotion toward brand or product
beautiful day austin come grab slice two check google get deal sxswi sxsw,,No emotion toward brand or product
google debut new selective social network today sxsw mention link google circles,,No emotion toward brand or product
trying decide session attend sxsw marissa meyer mention later today given,,No emotion toward brand or product
excellent deck rt mention nth time lucky googles new social network launch maybe link sxsw,,No emotion toward brand or product
quotthe default state users leisurely contemplativequot mention ipad sxsw,,No emotion toward brand or product
mobile definitely hot topic year every session standing room next lessons learnt building netflix iphone app sxsw,,No emotion toward brand or product
apple deliberately chose march 11 ipad 2 availability knowing large chunk customer base sxsw,,No emotion toward brand or product
