tweet_text,emotion_in_tweet_is_directed_at,is_there_an_emotion_directed_at_a_brand_or_product
rt mention kid ducked exposing 4chan4eva tattoo small back ipad flew right sxsw,,No emotion toward brand or product
rt mention line popup apple store phenomenal sxsw apple ipad2 link,,No emotion toward brand or product
rt mention lines already forming apples popup store austin arent people see festival link sxsw,,No emotion toward brand or product
rt mention lonely planet iphone app guide austin free week sxsw,,No emotion toward brand or product
rt mention next big thing hmmm rt mention google launch major new social network called circles possibly today link sxsw,,No emotion toward brand or product
rt mention news sxswi apples temporary ipad store sxsw wth,,No emotion toward brand or product
rt mention ppl authoritzed scrape republish pages r google bing bing google mention qagb sxsw,,No emotion toward brand or product
rt mention secret search sauce google bing spill beans google bing sxsw link,,No emotion toward brand or product
rt mention simplest gesture ipad used core interactions sxsw touchingstories,,No emotion toward brand or product
rt mention pats sxsw dont know im talking please google julia sweeney learn,,No emotion toward brand or product
rt mention still ipad 2s least sxsw popup apple store mention bought one,,No emotion toward brand or product
rt mention two days last 6 months mobile usage google maps higher desktop marissa mayer sxsw,,No emotion toward brand or product
rt mention art advertising statistics says mention google admob guy asked question sxsw sxflip sxswi,,No emotion toward brand or product
rt mention theres app think goingsons sxsw ipad hollergram link,,No emotion toward brand or product
rt mention theres yet another line austin apple store ipad 2 going well around block sxsw,,No emotion toward brand or product
rt mention theres class war forming sxsw ipad 2 owners vs first gen owners,,No emotion toward brand or product
rt mention little need parents anymore comment child playing ipad \x89ûómention connectedbrands sxsw,,No emotion toward brand or product
mention thinks may coined new term quotapptrophyquot happens unused iphone apps disuse apptrophy sxsw,iPad or iPhone App,No emotion toward brand or product
rt mention could first big news sxsw link google building new social framework,,No emotion toward brand or product
rt mention googlebing qampa panel like worlds expensive seo consultation sxsw,,No emotion toward brand or product
rt mention guy next using ipad 2 periscope sxsw,,No emotion toward brand or product
rt mention winning picture android google sxsw link,,No emotion toward brand or product
rt mention morning sxsw resurgence print design ipad design boomers amp nyt grid layouts also gatorade vom,,No emotion toward brand or product
rt mention best thing saw sxsw tonight rt mention security guards protecting ipad 2 awesome link,,No emotion toward brand or product
rt mention week ipad clip mention joins mention review free sxsw go app link ipad2 sxswgo,,No emotion toward brand or product
rt mention tim oreilly web 20 definition companies survived built value consumergenerated data ebay amazon google sxsw,,No emotion toward brand or product
rt mention tim oreilly web 20 definition firms tht survived built value frm consumergenerated data ebayamazongoogle sxsw,,No emotion toward brand or product
rt mention tim oreilly web 20 definition companies survived built value consumergenerated data ebay amazon google sxsw,,No emotion toward brand or product
rt mention tip sxsw hashtag search throttled mention dumb 420 errors use google eg link fsw,,No emotion toward brand or product
rt mention tips googles mention fewer people teams think making prototyping key agileagency sxsw,Google,No emotion toward brand or product
rt mention sxsw friends dont forget download sxswgo iphoneipad app link,,No emotion toward brand or product
rt mention dude propping ipad urinal time isnt valuable sxsw ewww,,No emotion toward brand or product
rt mention today sxsw bulletproof ux strategy games amp design patterns google anatomy design decision,,No emotion toward brand or product
rt mention tomlinson tx observer says apple subscription data holding biggest impediment success newsapps sxsw,,No emotion toward brand or product
rt mention tomorrow charles chen speaking android chromeos access mention google booth exhibit hall 3 mention 1pm sxsw,,No emotion toward brand or product
rt mention tomorrows panel css features folks opera chrome ie mozilla amp w3c apple downstairs selling ipads sxsw,,No emotion toward brand or product
rt mention tomorrows panel css panel features folks opera chrome ie mozilla w3c apple downstairs selling ipads ahem sxsw apple,,No emotion toward brand or product
rt mention tonight mention checking kills amp mention checking gsdampmgoogle party come say hi sxsw sxswi,,No emotion toward brand or product
rt mention tonight mention checking kills mention checking gsdampmgoogle party come say hi sxsw sxswi music,,No emotion toward brand or product
rt mention toptweets rt mention rumor apple opening temporary store downtown austin sxsw link,,No emotion toward brand or product
rt mention traveling sxsw ipad 1 3102011,,No emotion toward brand or product
rt mention tweet register exclusive passes events parties ipad 2 sxsw quotgive m\x89û cont link,,No emotion toward brand or product
rt mention tweet register exclusive passes events parties ipad 2 sxsw quotgive link,,No emotion toward brand or product
rt mention tweet register exclusive passes events parties ipad 2 sxsw quotgive liberty andor free sxswpass please rtquot,,No emotion toward brand or product
rt mention tweet register exclusive passes events parties ipad 2 sxsw liberty andor free sxswpass,,No emotion toward brand or product
rt mention tweet register exclusive passes events parties ipad 2 sxsw quotgive liberty andor free sxswpassquot,,No emotion toward brand or product
rt mention u got ta fight yr right party amp privacy aclugoogle sxsw partylikeits1986,,No emotion toward brand or product
rt mention uber brand smart gon na move ton ipad2 apple opening popup shop austin sxsw link viamention mention,,No emotion toward brand or product
rt mention uh oh rt mention left white iphone 4 cab austin sxsw internet please help,,No emotion toward brand or product
rt mention unloading ipads link sxsw apple ipad2,,No emotion toward brand or product
rt mention update recco link sxsw panelsparties def good times follow friends whove b4 youre newbie,,No emotion toward brand or product
rt mention updated hbs startuptribe meets sxsw sat 312 4pm link drinks alumni students check back 4 changes,,No emotion toward brand or product
rt mention use google profile fb entry point fb personal try digg google reader draw people hireme sxsw,,No emotion toward brand or product
rt mention use questionanswer askreceive kind model ipad app design give take entice ask mention tapworthy sxsw,,No emotion toward brand or product
rt mention used small upstarts twitter played sxsw big guys making moves apple google sxsw,,No emotion toward brand or product
rt mention important make sure donating japanese red cross japan link sxswcares sxsw pls rt,,No emotion toward brand or product
rt mention important make sure donating japanese red cross japan link sxsw quake,,No emotion toward brand or product
rt mention important make sure donating japanese red cross japan link sxswcares sxsw quake,,No emotion toward brand or product
rt mention important make sure donating japanese red cross japan link sxswcares sxsw quake please rt,,No emotion toward brand or product
rt mention via mention apple set open temp store downtown austin sxsw link ipad2,,No emotion toward brand or product
rt mention video popup apple store link sxsw sxswi,,No emotion toward brand or product
rt mention video interview mention amp mention sxsw quotgoogle dealsquot link,,No emotion toward brand or product
rt mention video google quotit gets betterquot featured gets better book due 322 sxsw sxswhomo link,,No emotion toward brand or product
rt mention video google quotit gets betterquot one featured gets better book due 322 sxsw sxswhomo link,,No emotion toward brand or product
rt mention vinh flipboard step forward ipad mags get right go path wired path sxsw,,No emotion toward brand or product
debating visiting apple popup store byebyemoney sxsw,,No emotion toward brand or product
rt mention w core week data still come mention searches sxsw 23 vs 10 source trends measure link,,No emotion toward brand or product
rt mention wait fiona apple town somebody kidnap put recording studio records new album sxsw,,No emotion toward brand or product
rt mention waiting line awesome south african contingent sxswsa sxsw apple link,,No emotion toward brand or product
rt mention walkin street mention navigating via google im tweeting random guy yelping welcome sxsw usguys,,No emotion toward brand or product
rt mention walking popup apple store like walking future ipad type computer sxsw,,No emotion toward brand or product
rt mention walking trade show sxsw basically swapping 10 business cards chances win 10 different ipad 2s,,No emotion toward brand or product
rt mention wan na know fast cellular signal sxsw get coverage austin ios free detailed maps link,,No emotion toward brand or product
rt mention want free juice pack air iphone 4 sxsw we\x89ûªll giving away 5 tobeannounced location stay tuned,,No emotion toward brand or product
rt mention want taste artists years sxsw heres free mix put itunes link,,No emotion toward brand or product
rt mention want ipad 2 chance apple opening temporary store sxsw link via mention,,No emotion toward brand or product
rt mention want win ticket 1 sxsw party rules simple link android unite android news masses android,,No emotion toward brand or product
rt mention intending bring trusty backpack upcoming trip sxsw number ipad 2s im helping b,,No emotion toward brand or product
rt mention watch mention sxsw link,,No emotion toward brand or product
rt mention watching guy simultaneously use laptop ipad force strong one mmm sxsw,,No emotion toward brand or product
rt mention watching ipadmade movie busy makes wish whatever party made instead sxsw,,No emotion toward brand or product
rt mention gearing sxsw interactive trade show across google link,,No emotion toward brand or product
rt mention giving away ipad 2 kick time sxsw visit fb page info link,,No emotion toward brand or product
rt mention cant talk liquid exp without talking kindle showing examples web kindle iphone versions liquidux sxsw,,No emotion toward brand or product
rt mention release android app cluster gt link sxsw,,No emotion toward brand or product
rt mention interrupt regularly scheduled sxsw geek programming big news link google circles,,No emotion toward brand or product
rt mention interrupt regularly scheduled sxsw geek programming big news link google circles huge,,No emotion toward brand or product
rt mention interrupt regularly scheduled sxsw geek programming big news link google circles socbiz,,No emotion toward brand or product
rt mention interrupt regularly scheduled sxsw geek programming big news link google circles,,No emotion toward brand or product
rt mention connect rt mention google launch major new social network called circles possibly today link sxsw,,No emotion toward brand or product
rt mention lustre pearl getting ready presentation team android awards sxsw,,No emotion toward brand or product
rt mention experimenting tinkering like nineties quotbest viewed ipad new best viewed internet explorer 6quot sxsw,,No emotion toward brand or product
rt mention giving away shiny ipad 2 sxsw quotables simply sign entered automatically gtgt link ipad2 sxsw,,No emotion toward brand or product
rt mention launching products mention sxsw plenty else join us 4 h4ckers amp 80s dancing 2day link,,No emotion toward brand or product
rt mention launching products sxsw join us h4ckers amp 80s dancing today link,,No emotion toward brand or product
rt mention launching products sxsw plenty else join us h4ckers today link,,No emotion toward brand or product
rt mention launching products sxsw plenty else link,,No emotion toward brand or product
rt mention launching products sxsw plenty else pensei que iriam lanì¤ar google circles,,No emotion toward brand or product
rt mention launching products sxsw plenty else link ltlt circles new apps ftrs,,No emotion toward brand or product
rt mention launching products sxsw plenty else link googlecircle,,No emotion toward brand or product
rt mention launching products sxsw plenty else join us 4 h4ckers amp 80s dancing link,,No emotion toward brand or product
rt mention launching products sxsw plenty else join us h4ckers amp 80s dan link,,No emotion toward brand or product
rt mention launching products sxsw plenty else join us h4ckers amp 80s dancing link,,No emotion toward brand or product
rt mention launching products sxsw plenty else join us h4ckers amp 80s dancing today link,,No emotion toward brand or product
rt mention launching products sxsw plenty else link cc mention,,No emotion toward brand or product
rt mention launching products sxsw plenty else join us h4ckers amp 80s dancing link,,No emotion toward brand or product
rt mention officially sxsw come mention grill mention us w zazzlsxsw you\x89ûªll get make iphone case,,No emotion toward brand or product
tr mention wondering many mention come back sxsw ipad 2s maybe everyone link,,No emotion toward brand or product
rt mention weather changed today sxsw get exclusive weather updates kxan austins jim spencer mention link,,No emotion toward brand or product
rt mention well hello sxsw heres free mention sampler celebrate festival year including barton hollow link,,No emotion toward brand or product
rt mention well hello sxsw heres free itunes sampler celebrate festival year link,,No emotion toward brand or product
rt mention digital tribes learn native americans dgtltribe sxsw oh win ipad 11am hyatt,,No emotion toward brand or product
rt mention apple security guy locks store sxsw link,,No emotion toward brand or product
rt mention what\x89ûªs new blogger link blogging blogger google sxsw,,No emotion toward brand or product
rt mention someone going ask bing copying googles search results qagb sxsw seo,,No emotion toward brand or product
rt mention google circles launch link quotmay good timing given twitter sxsw,,No emotion toward brand or product
rt mention flying sxsw wants mention free miles dm meill shoot code currently iphone,,No emotion toward brand or product
rt mention said ipad photos apple store sxsw mention mention mention lepanele link,,No emotion toward brand or product
rt mention whrrl girls handing chances win 2 audi cars come find us sxsw mention apple store sxsw link,,No emotion toward brand or product
rt mention barry diller thinks ipad content nuts mention sxsw mention link mentionw,,No emotion toward brand or product
rt mention google announce facebook clone sxsw include announcement product code link,,No emotion toward brand or product
rt mention google circles take facebook link circles sxsw,,No emotion toward brand or product
rt mention google circles take facebook link circles sxsw,,No emotion toward brand or product
rt mention google launch new social network called circles south southwest today link sxsw circles google,,No emotion toward brand or product
rt mention google preview major new social service called google circles today sxsw link,,No emotion toward brand or product
rt mention google preview major new social service called google circles today sxsw link cc mention,,No emotion toward brand or product
rt mention google reveal new social network called circles google facebook twitter sxsw link via mention,,No emotion toward brand or product
rt mention see googles new social network quotcirclesquot today link sxsw sxswi,,No emotion toward brand or product
rt mention william patry google says authors dont care copyright care income sxsw models,,No emotion toward brand or product
rt mention win ipad 2 bizgym video clipcon see intro reel link sxsw suasxsw sxswaccel ceokidschat entrepreneur smallbiz,,No emotion toward brand or product
rt mention win ipad 2 sxsw via mention sxsw link,,No emotion toward brand or product
rt mention win ipad2 signing link sxsw wantlet,,No emotion toward brand or product
rt mention win free ipad 2 webdoccom sxsw rt,,No emotion toward brand or product
rt mention win free ipad 2 webdoccom sxsw rt,,No emotion toward brand or product
rt mention win ipad rt mention dgtltribe learn native amer tx ballroom 57 1100am link sxsw,,No emotion toward brand or product
rt mention wish went sxsw got covered day 1 recap link coynes mention mention,,No emotion toward brand or product
rt mention xwave headsets actually control iphone apps brain sxswnui gsdm sxsw,,No emotion toward brand or product
rt mention woah dude sxsw gets branded tattoo exchange ipad really link mention think,,No emotion toward brand or product
rt mention wonder many ipads theyll sell tomorrow rt mention apple opening pop store sxsw link,,No emotion toward brand or product
rt mention wonder many ipads theyll sell rt mention opening pop store sxsw link,,No emotion toward brand or product
rt mention wondering street closures sxsw made google map show link sxsw austin,,No emotion toward brand or product
rt mention woohoo rt mention go game launches doityourself iphone scavenger hunts link via mention see sxsw,,No emotion toward brand or product
rt mention wow leo told random person street would send ipad 2 twit sxsw,,No emotion toward brand or product
rt mention written gwt new blogger interface shown week sxsw link,,No emotion toward brand or product
rt mention yayrt mention new ubersocial iphone app store includes uberguide sxsw sponsored mashable link,,No emotion toward brand or product
rt mention yes rumors true come play mention ipad booth sxsw exhibit hall 3 ipad ipad2 sxswi,,No emotion toward brand or product
rt mention yes theres line front allbutconfirmed popup apple store sxsw link,,No emotion toward brand or product
rt mention yikes google launching circles today sxsw link,,No emotion toward brand or product
rt mention download free mention sampler bands playing sxsw link,,No emotion toward brand or product
rt mention know plane sxsw u become facebook friends seatmate added ipad added laptop,,No emotion toward brand or product
dont iphone going sleep prepare sleep 3045 minutes sxsw pr,,No emotion toward brand or product
get popup apple store ipad 2 rt mention rt mention åç complete sxsw 2011 foursquare badge list link,,No emotion toward brand or product
rt mention zazzle gearing hit sxsw look tweets come create iphone case zazzlesxsw,,No emotion toward brand or product
1st session designing ipad interfaces link sxsw uxdes,,No emotion toward brand or product
protip dont show google analytics page sxsw presentation,,No emotion toward brand or product
everyone sxsw map favorite places austin link mention mention mention,,No emotion toward brand or product
sxsw anyone need iphone cable extras tweet,,No emotion toward brand or product
sxsw anyone know apple popup store,,No emotion toward brand or product
fuzzy iphone picture jake gyllenhaal duncan jones pictures soon bigdplacecom sxsw link,,No emotion toward brand or product
one say free music someone say free mention music yes yes link sxsw freemusic,,No emotion toward brand or product
quotno one says im apple im drupal tribe know people care children amp powerfulquot mention dgtltribe sxsw,,No emotion toward brand or product
sxsw iphone tip turn 3g get good servicedata,,No emotion toward brand or product
found iphone ballroom volunteer door sxsw sxswi,,No emotion toward brand or product
got one rt mention waiting line apple store check might find new item sxsw link,,No emotion toward brand or product
phones around blackberry iphone android distant third sxsw,,No emotion toward brand or product
free 22 song sxsw itunes playlist brighteyes thecivilwars glove many others link,,No emotion toward brand or product
6th congress scarborough bldg rt mention temporary apple store setup sxsw,,No emotion toward brand or product
mention googles disavowal planned launch sxsw,Google,No emotion toward brand or product
one left ipad 1 sxsw,,No emotion toward brand or product
connect rt mention google launch major new social network called circles possibly today link sxsw,,No emotion toward brand or product
guy front apple store austin reading bible wondering someone would give ipad bible app sxsw,,No emotion toward brand or product
ipad big rt mention takeaway sxsw mobile absolutely necessary brand relevancy link,,No emotion toward brand or product
tons good music mention free sxsw sampler via mention link,,No emotion toward brand or product
many good places rt mention youre racing around sxsw best fueling great local fare link,,No emotion toward brand or product
hotpot google marissameyer next clevelandsteamer sxsw,,No emotion toward brand or product
apple google zappos corporations always founded different important ideas rhjrux5 sxsw,,No emotion toward brand or product
google circles link google sxsw,,No emotion toward brand or product
google circles \x89ûïmention google launch major new social network called circles possibly today link sxsw\x89û\x9d,,No emotion toward brand or product
marissagoogle getting ready next panel googles marissa meyer presents vp consumer prods sxsw,,No emotion toward brand or product
google hacker party sxsw good times cle startupbus,,No emotion toward brand or product
demo google hotpot bettersearch panel still pull search personalized yet serendipitous sxsw,,No emotion toward brand or product
google image search jayden boy recognized mention man nikon camera commercials sxsw sxswnikon hisxsw,,No emotion toward brand or product
sxsw google maps mobile devices vp link,,No emotion toward brand or product
40 google maps usage mobile devices said mention sxsw link via mention gmaps,,No emotion toward brand or product
buzz google google circles social media shakedown brewing anything go hear head heart sxsw,,No emotion toward brand or product
marissagoogle says google testing small business software inpdx examples portlanders sxsw,,No emotion toward brand or product
20 google searches local information mayer sxsw,,No emotion toward brand or product
link google launch major new social network called circles social networking back basics sxsw,,No emotion toward brand or product
rt facebook hit adoption tipping pointlow chance successquotmention google 2 launch new social network called sxsw,,No emotion toward brand or product
line pop apple store austin first person 6 amthey wait 5 pm sxsw ipad2 link,Apple,No emotion toward brand or product
apples pop shop lavaca 6th sxsw yes line wraps around block mention apple store sxsw link,,No emotion toward brand or product
apples pop store austin took shape week thats call popup sxsw,,No emotion toward brand or product
apples pop store sixth street still giant line front people waiting ipad 2 apple sxsw insanity,,No emotion toward brand or product
popup apple store sxsw popup bar called dickbar,,No emotion toward brand or product
ipad 2 popup store sxsw link,,No emotion toward brand or product
apple open pop temporary store sxsw ipad 2 launch link via mention,,No emotion toward brand or product
apple open quotpopupquot guerrilla store 6th congress sxsw austin wonder theyre selling link,,No emotion toward brand or product
apple open popup store downtown austin 1st floor bldg 6th amp congress sxsw ipad 2 launch morefunpeoplewatching,,No emotion toward brand or product
apple open popup shop sxsw 6th congress ipad2 launch day link,,No emotion toward brand or product
apple open popup shop sxsw report link,,No emotion toward brand or product
apple open popup shop sxsw link,,No emotion toward brand or product
apple open popup shop sxsw report link sxsw,,No emotion toward brand or product
apple open popup shop sxsw report link sxsw,,No emotion toward brand or product
apple open popup shop austin sxsw ipad 2 release link,,No emotion toward brand or product
apple open popup shop austin sxsw ipad 2 release link via mention sxsw ipad2,,No emotion toward brand or product
apple open popup shop austin sxsw ipad 2 release link sxsw apple ipad2 popupshop,,No emotion toward brand or product
apple open temporary store sxsw link,,No emotion toward brand or product
apple open temporary store sxsw tipb link via mention sxsw,,No emotion toward brand or product
apple open temporary store sxsw 6th congress link,,No emotion toward brand or product
apple open temporary store sxsw interesting link,,No emotion toward brand or product
apple opening new store downtown austin friday make sure everyone sxsw buy new ipad 2 link,,No emotion toward brand or product
apple opening popup store austin sxsw link,,No emotion toward brand or product
apple opening popup store austin sxsw mention link,,No emotion toward brand or product
apple opening popup store austin sxsw mention link viamention,,No emotion toward brand or product
apple opening popup store austin sxsw link sxsw apps mobile,,No emotion toward brand or product
apple opening popup store downtown austin ipod 2 launch sxsw link,,No emotion toward brand or product
apple opening temp store austin sxsw link ipad2 via mention mention mention,,No emotion toward brand or product
apple opening temp store austin sxsw link via mention mention awesome,,No emotion toward brand or product
apple opening temp store austin sxsw link via mention ipad2,,No emotion toward brand or product
apple opening temporary store downtown austin sxsw amp ipad 2 launch link,,No emotion toward brand or product
apple opening temporary store downtown austin sxsw link ipad 2 anyone fb,,No emotion toward brand or product
